{
  "schemaVersion": "1.0.0",
  "requestId": "exec-req-deploy-frontend-review",
  "requestedAction": "deployment-review",
  "requestedBy": "studio-os-governance",
  "createdAt": "2026-06-05T00:00:00Z",
  "environment": "production",
  "scope": {
    "targetType": "external-system-reference",
    "targetName": "frontend-deployment",
    "changeSummary": "Evaluate whether a future frontend deployment request has governance prerequisites."
  },
  "approvalRequirement": "single-human",
  "executionBoundary": {
    "executionEnabled": false,
    "providerCallsAllowed": false,
    "deploymentAllowed": false,
    "secretAccessAllowed": false
  }
}
